k_products,name,price,condition,k_categories
MCO624337760,"Impermeable Siliconado Para Motociclista",55783,new,MCO90075
MCO625234737,"Forros Sillas Fundas Protector Mascotas Perros Gat",29900,new,MCO407376
MCO625679214,"Cortadora De Pelo Kemei Km-1986 Dorada 100v/240v",135753,new,MCO5411
MCO627118638,"Set X 2 Pulseras Manillas Magneticas Parejas Amor ",17862,new,MCO1434
MCO628942771,"Collar Cadena Para Hombre Plateado Simple Elegante",24000,new,MCO116331
MCO629003941,"Forro Protector De Baúl Para Camioneta - Mascotas",134990,new,MCO407376
MCO632902146,"Media Pantalón Para Niñas En Microfibra",22000,new,MCO420453
MCO633490549,"Amazon Fire Tv Stick Lite Control De Voz Full Hd 8",155796,new,MCO176837
MCO637387640,"Combo Escalera Multiproposito De 12 Pasos + Plataf",408800,new,MCO172892
MCO638199236,"Máquina Recortadora Kemei Km-1971 Negra 100v/240v",90673,new,MCO5411
MCO638628834,"Ducha Eléctrica Graduable Y Regadera De Lujo Bocch",106800,new,MCO436136
MCO638633814,"Ducha Eléctrica Automatica Regadera De Lujo 15cm B",103800,new,MCO436136
MCO641041046,"Cojin Peluche Almohada Estrella Led Felpa Luces Mu",22900,new,MCO176652
MCO642326453,"Kit Pesas 40 Kilo Set Convertible Pesa Rusa Barra ",290900,new,MCO167674
MCO648959276,"Ducha Eléctrica Graduable Regadera De Lujo 15 Cm. ",99800,new,MCO436136
MCO651721421,"Teclado Organeta Yamaha Psr-e273 + Base + Forro + ",910000,new,MCO2997
MCO651892965,"Couscous ( Semola ) 500g - Unidad a $22000",22000,new,MCO389311
MCO652550949,"Smart Tv Samsung Series 5 Un40t5290akxzl Led Tizen",1093900,new,MCO14903
MCO653379741,"Juego De Rachet Y Copas, 22 Piezas En Pulgadas - P",55900,new,MCO372032
MCO654174753,"Silla Gamer Oficina Trabajo Estudio Juegos Cuidado",405000,new,MCO447782
MCO654964557,"Real Tattoo Soap Jabon Para Tatuaje Antibacterial",15189,new,MCO412113
MCO655315738,"Mouse Gamer De Juego Logitech  G Series Lightsync ",102000,new,MCO1714
MCO655319096,"Micrófono Shure Pg Alta Pga48-xlr Dinámico Cardioi",234500,new,MCO4633
MCO657145240,"Sony Playstation 5 825gb Standard Color  Blanco Y ",2509900,new,MCO2931
MCO659000120,"Aguja Para Dermapen Dr. Pen A6",2900,new,MCO180917
MCO659266309,"Maíz Cat 10kg -  Arena Ecológica Para Gatos - Inhi",52950,new,MCO116338
MCO802230162,"Tarjeta De Memoria Kingston Sdcs2sp  Canvas Select",31500,new,MCO7908
MCO802546115," Roku Express 3930 Se Estándar Full Hd 32mb Con 51",137750,new,MCO176837
MCO802551062,"Roku Express 3930 Estándar Hd 32mb Negro Con 512mb",137750,new,MCO176837
MCO805200423,"Bolsa Organza 50un 9x12 Recordatorio Boda Joyeria ",19458,new,MCO8591
MCO806410286,"Bitcoin Dorada Moneda De Coleccion Alta Calidad Bl",12900,new,MCO9355
MCO809270670,"Maíz Cat 20kg -  Arena Ecológica Para Gatos - Inhi",112990,new,MCO116338
MCO809366397,"Silla Gamer Gaming Consola Pc Ergonomica Reclinabl",599900,new,MCO447782
MCO814278017,"Disco Sólido Ssd Interno Crucial Ct480bx500ssd1 48",126500,new,MCO1672
MCO817828161,"Moneda Conmemorativa 10.000 Pesos Bicentenario Col",21450,new,MCO9355
MCO818502708,"Nintendo Switch 32gb Standard Color  Rojo Neón, Az",1234900,new,MCO2931
MCO820065046,"Anillo Cadena De Eslabones Giratoria Acero Inoxida",19710,new,MCO116329
MCO822937587,"Cactus Bailarín Canta Y Imita La Voz Peluche Luces",37900,new,MCO176652
MCO824332739,"Camara Robotica Inalambrica Wifi 3 Antenas 360º",72016,new,MCO5844
MCO825255064,"Impermeable Siliconado Para Motociclista",53940,new,MCO90075
MCO826195958,"1,5kg Resina Epoxica Para Mesas Y Pisos /espacio4d",120000,new,MCO455716
MCO826656756,"10 Billetes De Colombia De 1 Peso Hasta 1000 Pesos",74820,new,MCO9356
MCO827857839,"Micrófono Sf 666 Condensador Omnidireccional Negro",22847,new,MCO4633
MCO837371283,"111 Globos Bombas De Agua En 60 Seg Recargador Mag",14480,new,MCO435877
MCO837893754,"Nintendo Switch Oled 64gb Standard Color  Blanco Y",1394900,new,MCO2931
MCO838408769,"Termohigrometro Digital Sonda Termo Higrometro Ter",13850,new,MCO166629
MCO839182590,"Venta Paquete De 300 Tokens Chaturbate",96000,new,MCO166867
MCO841016027,"Moneda 10000 Pesos Bicentenario  Colombia,conmemor",22870,new,MCO9355
MCO844430562,"Tarjeta De Memoria Adata Ausdx64guicl10-ra1  Premi",17000,new,MCO7908
MCO845395714,"Tarjeta De Memoria Adata Ausdx128guicl10a1-ra1  Pr",32300,new,MCO7908
MCO849113339,"Máquina Afeitadora Y Cortadora De Pelo Philips Mg3",134999,new,MCO5411
MCO849642482,"Corrector De Postura Y Faja Ajustable, Soporte Par",70000,new,MCO8837
MCO849880090,"Inflador De Bombas Globos Eléctrico Inflar Decorac",57900,new,MCO432170
MCO851263844,"Creatina Monohidratada X 300gr",128900,new,MCO8830
MCO853311785,"Escalera Taburete Butaco 2 Peldaños Truper 10499",46900,new,MCO172892
MCO854541007,"Peluche Pokemon Squirtle Bulbasaur Gengar Regalo C",41308,new,MCO176652
MCO857659492,"Audífonos Sony Noise Cancelling Bluetooth Hi-res W",959900,new,MCO3697
MCO857876857,"Palo Santo Sahumerio Incienso",15900,new,MCO387586
MCO860609691,"Corrector Postura Lumbar Iman Espalda Magnetico 4 ",89900,new,MCO8837
MCO862593821,"Tablero Acrílico Blanco Borrable 60 X 40cm + Porta",39990,new,MCO168370
MCO863250196,"Báscula Digital Xiaomi Mi Body Composition Scale 2",109900,new,MCO169104
MCO863789017,"Tablero Acrílico Blanco Borrable 80 X 60cm + Porta",71900,new,MCO168370
MCO865169207,"Caja X 100 Unds Guantes Nitrilo",34317,new,MCO169105
MCO866969131,"Tónico Despigmentante 40 Ml - mL a $33900",33900,new,MCO180917
MCO870949211,"Audífonos In-ear Gamer Inalámbricos Lenovo Livepod",67146,new,MCO3697
MCO872320444,"Disco Duro Externo Toshiba Canvio Basics Hdtb410xk",185394,new,MCO1672
MCO873278577,"Gemelos Epoxicos Rigidos Cristal (1kg Mezcla) - Co",92500,new,MCO455716
MCO874548038,"Tarjeta De Memoria Sandisk Sdsqunr-064g-gn3ma  Ult",30088,new,MCO7908
MCO875961922,"Parches Cicatrizante Tatuajes X 10 Unds Tipo Sanid",22000,new,MCO412113
MCO878562334,"Kit De Teclado Y Mouse Gamer Xtrike Me Cm-406 Ingl",92900,new,MCO6263
MCO879600173,"Mouse Vertical Inalámbrico Delux  M618c Black",69223,new,MCO1714
MCO880067853,"Alimento Hill's Prescription Diet Kid - kg a $5272",134469,new,MCO1087
MCO883380194,"Medias Rodilleras De Gateo Para Bebes Antidestizan",16000,new,MCO420453
MCO884549461,"Ventilador De Pared Y De Pie Samurai Ultra Silence",294900,new,MCO115346
MCO885660169,"Regadera Ducha Acero 20 X 20 Cm Cuadrada Con Tubo",36900,new,MCO411026
MCO886664833,"Mouse Genius  Dx-120 Calm Black",14127,new,MCO1714
MCO886854182,"Moneda 10000 Pesos Bicentenario  Colombia,conmemor",22470,new,MCO9355
MCO887138499,"Silla De Oficina Jamundí Base Nylon Mueblesya Ergo",393900,new,MCO177115
MCO888261248,"Samsung Televisor Smart   32  Hd 32t4300",848800,new,MCO14903
MCO888754348,"Kit De Teclado Y Mouse Inalámbrico Logitech Mk235 ",94000,new,MCO6263
MCO891829845,"Cera Agiva En Polvo - g a $1595",31900,new,MCO388015
MCO893329851,"200 Metros De Cabuya De Fique Ecologica Rascador G",35903,new,MCO384755
MCO899252596,"Resina Gemelos Epoxicos Rigidos Cristal (500g Mezc",64500,new,MCO455716
MCO899357351,"Ducha Electrica Boccherini Gold Superautomática 11",53100,new,MCO436136
MCO902491852,"Hidrolavadora Eléctrica Takima Tkpw1200-13 Roja De",245000,new,MCO166618
MCO905502214,"Alimento Kirkland Signature Super Pre - kg a $1317",151920,new,MCO1087
MCO908319636,"Microsoft Xbox Series S 512gb Standard Color  Blan",1504900,new,MCO2931
MCO908325300,"Pijama Moto Semi-impermeable + Forro Para Maletín ",49900,new,MCO90075
MCO921217913,"Audífonos Inalámbricos Lenovo X3 Negro Con Luz Led",59493,new,MCO5072
MCO921346054,"Audífonos Sony Bluetooth Noise Cancelling | Wh-100",1499900,new,MCO3697
MCO923394139,"Silla De Escritorio Silla Gamer Reclinable Ergonom",434900,new,MCO447782
MCO924066135,"Silla Gamer De Escritorio Reclinable Ergonomica 36",434900,new,MCO447782
MCO925179713,"Juego De Cartas Agilizate Iokus",24900,new,MCO1161
MCO931428074,"Cinta Doble Faz Adhesiva Silicona Multiusos Reutil",19900,new,MCO180001
MCO938329955,"Extractor Doble Leche Materna Electrico - Lactanci",59000,new,MCO39945
MCO941958230,"Cafe Sello Rojo Fuerte X 500 Gr",19050,new,MCO409413
MCO941970394,"Cafe Matiz Escarlata Capsulas Express X 10 Unidade",16850,new,MCO409413
MCO942941507,"Vitafer L Gold Pack X 2 Energizantes - mL a $56",56050,new,MCO442309
MCO943148146,"Guantes Descartables Alfasafe Color Transparente T",17000,new,MCO169105
MCO945506053,"Rollo De Salvia Blanca Californiana Importada Sahu",18900,new,MCO387586
MCO946567581,"Hidrolavadora Eléctrica Truper Hila-1500 Naranja/n",347000,new,MCO166618
MCO947523386,"Vitafer Energizante X4 Unidades - mL a $188",94000,new,MCO442309
MCO949515796,"Cinta Ancha Adhesiva Transparent X 6 Rollos Empaqu",47900,new,MCO180001
MCO952510269,"Cortadora De Pelo Vgr V-085 Dorada 100v/240v",47025,new,MCO5411
MCO954734455,"Vitafer L Energizante Sachet X 15 Unida - mL a $15",23750,new,MCO442309
MCO957178980,"Bicicleta Estática De Spinning Banda Silenciosa Vo",805380,new,MCO31049
MCO960781205,"Rollo De Cinta Kinesiologica Neuromuscular Kinesio",15055,new,MCO179916
MCO962007928,"Cinta Ancha Adhesiva Transparen X 300metros Empaqu",14787,new,MCO180001
MCO963823612," Jenga Clásico Hasbro A2120",80401,new,MCO1161
MCO963829794,"Juego De Mesa Monopoly Super Electronic Banking Ha",135920,new,MCO1161
MCO970737622,"Alimento Hill's Science Diet Adult Para Gato Adult",299000,new,MCO1087
MCO980258391,"Reloj Termohigrometro Digital Sonda Temperatura Hu",23900,new,MCO166629
MCO987762437,"Juego De Mesa Rummi-q Plásticos Asociados 6059",90100,new,MCO1161
MCO988219659,"Mouse Vertical Inalámbrico Recargable Weibo  Wb-88",37900,new,MCO1714
MCO991053204,"Micrófono Inalámbrico De Solapa Para Celular Profe",165000,new,MCO4633
MCO992854032,"Silla De Escritorio Ergonomus Niza Base Nylon  Neg",368900,new,MCO113544
