k_products,name,price,condition,k_categories
MCO1003580531,"Silla De Oficina Jamundí Base Nylon Mueblesya Ergo",369900,new,MCO113544
MCO1018082450,"Uniforme Enfermeria Estetica Antifluido Scrub ",56905,new,MCO441893
MCO1021671915,"Combo 2 Ventiladores Samurai Air Maxx Blanco Con A",239800,new,MCO115346
MCO1021694923,"Regadera Cuadrada Ducha Inoxidable 20 X 20 Cm Con ",29900,new,MCO411026
MCO1022676703,"Protector Forro Cubre Asiento Carro Perros Mascota",144990,new,MCO407376
MCO1023132577,"Vitafer Energizante X500ml - mL a $28890",28890,new,MCO442309
MCO1023133112,"Silla De Escritorio Urban Design Bl-2001 / Sa-4006",304900,new,MCO113544
MCO1031567912,"Guantes De Nitrilo Negro Caja X100 Unds",30000,new,MCO169105
MCO1036009191,"Uniforme Antifluido Dama",56905,new,MCO441893
MCO1036794678,"Nintendo Switch Oled 64gb Splatoon 3 Edition Color",1454900,new,MCO2931
MCO1036936057,"God Of War Ragnarök  Standard Edition Sony Ps4 Fís",200506,new,MCO163237
MCO1037658202,"Audífonos In-ear Inalámbricos Bluetooth F9-5 Negro",24250,new,MCO3697
MCO1052148226,"Máquina Recortadora Vgr V-228 Dorada 100v/240v",49900,new,MCO5411
MCO1052185573,"Google Chromecast 4 Tv Cuarta Generación Hdr ",245655,new,MCO176837
MCO1052199080,"Micrófonos Inalámbricos Solapa 2 En 1 Para iPhone ",92055,new,MCO4633
MCO1063452507,"Bicicleta Estática Urbanfit Pro Sh-612 Para Spinni",599900,new,MCO31049
MCO1076797735,"Cargador iPhone Carga Rapida Completo 7/8/x/11/12/",69300,new,MCO39268
MCO1083654225,"Mini Baileys Tripack Económico Original - mL a $12",37900,new,MCO442299
MCO1084135327,"Hidrolavadora Inalambrica Portátil Recargable 48v ",144900,new,MCO166618
MCO1119327698,"Memoria Micro Sd 64 Gb Clase 10 Np Ultra Rapida Pa",17500,new,MCO7908
MCO1143460951,"Cinta Doble Cara Extra Fuerte Vhb Trasparente 3m 1",33155,new,MCO180001
MCO1143704884,"Cámara De Seguridad Tp-link Tapo C200 V1 Tapo Smar",146300,new,MCO5844
MCO1146462576,"Disco Sólido Ssd Interno Western Digital Wd Green ",88400,new,MCO1672
MCO1146690217,"Combo Teclado Y Mouse Inalambrico Tj-808 Español Ñ",39990,new,MCO6263
MCO1149628905,"Gel Definidor De Rizos Etniker - g a $66",18624,new,MCO388015
MCO1149951426,"Escalera Tijera 5 Pasos Tipo Iii Con Bandeja Trupe",253807,new,MCO172892
MCO1156998687,"Carrasca Valle Natera Guacharaca + Trincho",35900,new,MCO413431
MCO1166708894,"Apple iPhone 13 (128 Gb) - Azul Medianoche",3299900,new,MCO1055
MCO1173011509,"Silla Escritorio Ergonomica Oficina Giratoria Secr",217900,new,MCO113544
MCO1174859134,"Minoxidil 5% Para Cabello/barba - Ml A - mL a $997",31952,new,MCO1266
MCO1188481332,"Aguardiente Amarillo De Manzana Sin Azúca - L a $9",61546,new,MCO442299
MCO1191948371,"Televisor Kalley 32  Atv32hdw Hd Led Plano Smart T",703900,new,MCO14903
MCO1195344854,"Arena Fofi Cat - 25 Kg",107000,new,MCO116338
MCO1196335417,"Aguardiente Amarillo Litro - mL a $78",78000,new,MCO442299
MCO1197239895,"Cera Capilar #1 Classic Matte Salon In R - g a $39",28405,new,MCO388015
MCO1217054759,"Ventilador Samurai Air Maxx Blanco Con Azul",139900,new,MCO115346
MCO1229804522,"Kit Regadera Cuadrada Ducha Acero Inoxidable 20 X ",29900,new,MCO411026
MCO1229828133,"Audífonos In-ear Inalámbricos Bluetooth F9-5 Negro",24256,new,MCO5072
MCO1233639677,"Milky Way Barra De Chocolate Y Caramelo 52.2 G",3960,new,MCO177942
MCO1233749932,"Bascula Pesa Vidrio 180kg Inteligente Con  Bluetoo",32900,new,MCO169104
MCO1241067039,"Deja De Ser Tu Joe Dispenza",60500,new,MCO1196
MCO1241407488,"Alimento Max Cat Professional Line Para Gato Adult",166000,new,MCO1087
MCO1250889253,"Guantes De Nitrilo Talla S - M - L 100 Unidades Co",28300,new,MCO169105
MCO1255600587,"Muñeco De Peluche Chainsaw Man Pochita, 40 Cm, Fig",41308,new,MCO176652
MCO1261264625,"Sérum Serum Ácido Hialurónico L'oréal Paris Revita",53977,new,MCO180917
MCO1262193848,"Disco Sólido Ssd Interno Adata Ultimate Su650 Asu6",72000,new,MCO1672
MCO1265885894,"Xiaomi Pocophone Poco X5 5g Dual Sim 256 Gb Negro ",1050028,new,MCO1055
MCO1266751954,"Pila Recargables Aa X2 Energizer",25000,new,MCO7279
MCO1266840437," Moto G52 Dual Sim 128 Gb Azul 6 Gb Ram",669900,new,MCO1055
MCO1270298146,"Stmnt Juliocvesar Matte Paste - Ml A $9 - mL a $90",94900,new,MCO388015
MCO1271906953,"Batería Pila Cr2025 Nueva Sony Original Litio, 3v,",11000,new,MCO7279
MCO1272255269,"Libro El Poder De La Mente Subconsciente - Origina",22056,new,MCO1196
MCO1272637849,"Minecraft: Java & Bedrock Edition  Microsoft Pc Có",88900,new,MCO163237
MCO1277874836,"Power Bank Pila Bateria Portatil 10000mah Real 1ho",39920,new,MCO39268
MCO1278503733,"Encuentra Tu Persona Vitamina( Libro Y Original )",51500,new,MCO1196
MCO1279406789,"Espejo Punto Ciego Para Retrovisores Carro, 360° S",11200,new,MCO174843
MCO1280553681,"Televisor Kalley 43  Android Smart Fhd Atv43fhde",1015900,new,MCO14903
MCO1280781823,"Betta Buffet Pellets 28gr Omega One Para - g a $49",13900,new,MCO1094
MCO1282445851,"Chocolatina Jet Leche Plegadiza X 50 Un - Kg A $55",29880,new,MCO177942
MCO1283536390,"Hidrolavadora Inalambrica Portátil Recargable 48v ",160900,new,MCO166618
MCO1289710123,"Vitafer Energizante 500ml - mL a $46",15320,new,MCO442309
MCO1289759531,"Audifonos Deportivos Lenovo Thinkplus Xe05 Neckban",39900,new,MCO5072
MCO1296635525,"Omega One Cichlid Pellets Super Color  Small Sinki",60900,new,MCO1094
MCO1298001157,"Minoxidil Forte 5% 5g Solución Tópica E - mL a $66",125600,new,MCO1266
MCO1298484101,"Cargador Cubo +cable Carga Rápida Para iPhone Tipo",22489,new,MCO39268
MCO1302725809,"Omega One Goldfish Small Pellets 226g Al - g a $13",30900,new,MCO1094
MCO1302845917,"Disco Duro Externo Toshiba Canvio Basics Hdtb420xk",259393,new,MCO1672
MCO1305528319,"Silla Gamer Escritorio Ergonomica Giratoria Ajusta",570900,new,MCO447782
MCO1305688647,"Torre Ducha Con Teleducha Telefono Regadera De Bañ",383900,new,MCO436136
MCO1309466399,"Celular Tecno Spark 10 Pro 256gb / 8ram / 50mp",534900,new,MCO1055
MCO1316444417,"Tubifex Gusano Comida Alimento Peces Acuario Omega",36900,new,MCO1094
MCO1344037109,"Castilla Casa Nueva Rentable Venta 7 Aptos 4 Nivel",950000000,new,MCO1468
MCO1344696217,"Venta Casa Via Palmas Sector El Poblado Medellín ",4180000000,used,MCO1468
MCO1345216347,"Renault Logan 1.6 Expression 2015",33300000,used,MCO1744
MCO1345220409,"Chevrolet Optra",28900000,used,MCO1744
MCO1345258795,"Volkswagen Gol Trendline",45900000,used,MCO1744
MCO1345271823,"Volkswagen Gol Trendline ",47500000,used,MCO1744
MCO1355112576,"Arroz Diana - Kg A $4840 - kg a $4680",23900,new,MCO389311
MCO1367809772,"Fifa 23  Standard Edition Electronic Arts Ps4 Digi",74900,new,MCO163237
MCO1391351920,"Padre Rico Padre Pobre Kiyosaki Robert ( Y Origina",37000,new,MCO1196
MCO1433346850,"Tetra Tetracolor Granulos Tropicales X 3 - g a $14",52900,new,MCO1094
MCO1443043292,"Cera Fijador En Barra Con Productos Nat - g a $100",41016,new,MCO388015
MCO1469194004,"Estuche Chocolates Sabor A Licor Borrach - kg a $5",10925,new,MCO177942
MCO1473256260,"Café Sello Rojo Fuerte X 500 Gr",17150,new,MCO409413
MCO1473519128," Cactus Bailarin Imita Voz, Musical, Bailarin Jugu",30991,new,MCO6563
MCO1481986924,"Doble Extractor Leche Materna Eléctrico Real Bubee",70256,new,MCO39945
MCO1507740800,"Bicicleta Estática Home Sale Spinning Color Negro ",562500,new,MCO31049
MCO1514715352,"Adata P20000qcd Power Bank 20000mah Carga Rápida Q",139900,new,MCO39268
MCO1554863580,"Smart Tv Kalley Series W K-atv40fhdw Led Android 1",952900,new,MCO14903
MCO1563649204,"Maíz Cat X20kg - Arena Ecológica Para Gatos - Inhi",112990,new,MCO116338
MCO1563654634,"Audífonos Lenovo Gm2 Pro Inalambrico Gaming Deport",53035,new,MCO5072
MCO1568165218,"Chocolates Garoto Caja 170gr",13320,new,MCO177942
MCO1579941218,"Xiaomi Power Bank  20000 Mah Dual Usb",119000,new,MCO39268
MCO1613602998,"Arroz Diana De 25 Libras",56900,new,MCO389311
MCO1636862216,"Hábitos Atômicos, De James Clear. Editorial Paidós",55000,new,MCO1196
MCO1644527426,"Libro Hábitos Atómicos - James Clear",55000,new,MCO1196
MCO1669711730,"Roku Se | Reproductor De Streaming Hd Con Cable Hd",129900,new,MCO176837
MCO1718493958,"Regadera Cuadrada Ducha Negra Mate Moderna 20 X 20",34900,new,MCO411026
MCO1742275520,"Xiaomi Redmi Note 12s Dual Sim 256 Gb Onyx Black 8",819000,new,MCO1055
MCO1794362646,"Alimento Hill's Prescription Diet Urinary Care C/d",110121,new,MCO1087
MCO1818788010,"Hidrolavadora Electrica Femmto Hlt203 1400w Alta P",259900,new,MCO166618
MCO1939385316,"Apartamento Amplio Con Finos Detalles",780000000,used,MCO1474
MCO1940232866,"Apartamento En Venta Robledo ",212000000,used,MCO1474
MCO1940554524,"Vendo Apartamento En Itagui Ciudadela Del Parque",350000000,used,MCO1474
MCO1941429658,"Hermosa Casa En Venta Esquinera 67m2 Con Parqueade",320000000,used,MCO1468
MCO1941472550,"Bello Apartamento En El Rodadero A 2 Cuadras De La",450000000,used,MCO1474
MCO1941827244,"Venta Casa En Envigado De Dos Niveles Excelente Ub",649000000,used,MCO1468
MCO1943081956,"Casa En  Prado Centro(medellin) Rah Co: 23-716",740000000,used,MCO1468
MCO1943136854,"Apartamento En Venta El Poblado Sector Castropol M",520000000,new,MCO1474
MCO1949418108,"Toyota Prado Sumo 2.7 Sumo 2009",89000000,used,MCO1744
MCO448680136,"Balanza Personal De Baño Bascula Digital Pesa Pers",29000,new,MCO169104
MCO448974244,"Pantalon Jean Dotacion Algodon Trabajo Indigo Clas",35600,new,MCO157289
MCO449760590,"Transfer Factor X 90 Capsulas - Unidad a $1999",179900,new,MCO8830
MCO451911428,"Caucho Silicona Mold 25 Estaño Liquido Moldes X500",62900,new,MCO3530
MCO452039633,"Impermeable Moto 4 Piezas Cal18 Original Sdc 2 Obs",66405,new,MCO90075
MCO452050273,"Corrector De Postura Para Dama S, M, L, Xl, Xxl Be",39990,new,MCO8837
MCO452503464,"Mini Teclado Inalámbrico Airmouse Android Smart Tv",22900,new,MCO6263
MCO452730522,"Agujas Para Dermapen De 36 Entrada Presión-entrega",2900,new,MCO180917
MCO452812575,"Recarga 25gr Fibras Capilares Toppik  - - g a $680",17005,new,MCO1266
MCO454101711,"Collar Reliquias De La Muerte Harry Potter Color P",6500,new,MCO116331
MCO456800629,"Bi Pro, Proteina Bipro Envío Gratis - L a $74950",149900,new,MCO8830
MCO458337978,"Collar Giratiempo Harry Potter Hermione Giratiempo",14900,new,MCO116331
MCO458367604,"Recordatorio Suculenta: Baby Bautizo Primera Comun",96000,new,MCO8591
MCO459834395,"Gran Teclado 37 Organeta Piano Graba Pistas +que U",110415,new,MCO2997
MCO461097759,"Caja Organizador Guardar Dientes De Leche Niños Ra",28900,new,MCO8591
MCO462637378,"Kit Mancuernas / Pesas 21kg/44lb Antideslizante Es",223000,new,MCO167674
MCO463234506,"Globos Led Gigante 45 Cm + Micro Led Globo Vinilo ",7900,new,MCO435877
MCO463365373,"Tablero Acrílico Liso 1.20cm X 80cm Perfil En Alum",119508,new,MCO168370
MCO464415871,"Juego De Herramienta 85pz Copas Reparación Carro M",99990,new,MCO372032
MCO465527132,"Inflador De Globos Electrico 600 Watts Doble Boqui",58000,new,MCO432170
MCO467355125,"Silla  Vibradora Mecedora Musical  Niña-niños Baby",138385,new,MCO71985
MCO468105007,"Coche De Lujo Tipo Deportivo Maletero En Aluminio ",430000,new,MCO15047
MCO468334516,"Camisetas Tipo Polo En Color Para Hombre Y Dama 22",26691,new,MCO157283
MCO469635330,"Bascula Digital Pesa Personas Baño Pantalla 180kg ",29501,new,MCO169104
MCO469664474,"Abanico Madera Importado Boda, Matrimonio, Shower ",4000,new,MCO3530
MCO470190704,"Papel Bond En Rollo 61 Cm X 50 Mts De 75 Gramos Pa",34000,new,MCO441185
MCO472110190,"Camisetas Cuello Redondo En Algodón 180 Gramos En ",18031,new,MCO157283
MCO472123435,"Hojas Para Billetes Antiguos Colombianos Tiene 3 D",7000,new,MCO9356
MCO475096892,"Pulsera Manilla Cuero Medalla San Benito Para Homb",26917,new,MCO1434
MCO478286595,"Abanico Madera Natural Personalizado Recordatorio ",4500,new,MCO3530
MCO481972170,"Fibras Capilares Queratina 27.5gr. Toppik - G A $ ",24605,new,MCO1266
MCO485749035,"Arena Para Gatos - Absorbente - 50 Kg ",120000,new,MCO116338
MCO486423233,"Coche Paseador Para Bebe Tipo Maleta + Toldillo",430000,new,MCO15047
MCO487328580,"Hojas Para Billetes Antiguos  Tiene 3 Divisiones ",6150,new,MCO9356
MCO490098494,"Kit Profesional Tatuaje Tattoo Tatuar 2 Maquinas T",234900,new,MCO412100
MCO492286261,"Globos Led Burbuja 45 Cm + Micro Led + Base Globo ",6999,new,MCO435877
MCO494833888,"Guiro Guacharaca 32x12 Cms En Acero Trinche Mango ",86900,new,MCO413431
MCO497301208,"Doble Extractor Leche Materna Eléctrico Real Bubee",70256,new,MCO39945
MCO497763590,"Silla Mecedora, Vibradora Y Musical Para Bebe 3 En",139410,new,MCO71985
MCO499594439,"Abanico De Madera Seda Hora Loca Personalizado Mat",4499,new,MCO3530
MCO500512373,"Globos Chinos Decoración Fiestas Hora Loca Eventos",3999,new,MCO435877
MCO502633990,"Camara Ip Wifi Vision Nocturna  2mpx 3 Antenas Lee",67250,new,MCO5844
MCO503571224,"Espejo Retrovisor Pivote Base Amarok Transporter Q",79900,new,MCO174843
MCO503652672,"Mothers Milk Tea / Te Que Promueve La Lactancia Ma",39000,new,MCO39945
MCO504267925,"Soplete Gas Propano",95000,new,MCO372032
MCO504520226,"Globos Metalizados Letras Números 40 Cm Dorados Pl",2999,new,MCO435877
MCO508947965,"Ropa Bebe Medias Cachemir Para Bebes Media Pantalo",15000,new,MCO420453
MCO509093160,"Radio Carro Bluetooth + Camara Usb Sd Pantalla 7 H",184900,new,MCO409392
MCO509657584,"Rollo Cinta Antideslizante Adhesiva 2 PuLG Rollo X",25555,new,MCO180001
MCO510803821,"10 Pilas Baterías Reloj Ag13 Lr44/a76/357a/sr44",8900,new,MCO7279
MCO511037729,"Recordatorio Vela Baby Shower  Boda Primera Comuni",88000,new,MCO8591
MCO512745029,"Poliacrilato Sodio 1 Kg 100%  Original Hidroretene",31255,new,MCO3530
MCO513152137,"Cinta Cohesiva Coban ",9025,new,MCO412100
MCO513434416,"Tablero Acrílico Blanco Borrable 120 X 80cm + Port",122900,new,MCO168370
MCO515180545,"Termometro Digital Lcd Refrigerador Nevera Ambient",9690,new,MCO166629
MCO515230223,"Cartuchos Agujas Repuesto Nano Para Dermapen Bayon",2900,new,MCO180917
MCO518761547,"50 Metros De Soga Mecate Cabuya Fique 6 Mm Ideal R",46550,new,MCO384755
MCO521750415,"Inflador Electrico De Globos",56498,new,MCO432170
MCO521762799,"Inflador Electrico De Globos",57405,new,MCO432170
MCO521858816,"Anillo El Señor De Los Anillos Acero Inoxidable X ",13765,new,MCO116329
MCO526158530,"Htc2. Termohigrometro Digital  Sonda Temp , Humeda",29600,new,MCO166629
MCO528499699,"Extractor De Leche Materna Electrico Doble Sacalec",60000,new,MCO39945
MCO532318478,"Radio 1 Din Mp5 Pantalla 4.1 Bluetooth Usb Mirrorl",154900,new,MCO409392
MCO532534414,"Caja Musical Queen Bohemian Rhapsody Regalo Fan Me",43000,new,MCO1228
MCO533024461,"Vinilo De Corte Por Metros",10999,new,MCO1228
MCO535020399,"Camibusos Manga Larga 100% Algodón Cuello Redondo ",22951,new,MCO157283
MCO535582647,"Billetes De 100 Dólares Dorado",9000,new,MCO9356
MCO536096623,"Silla Mecedora Vibradora Musical Y Anti Reflujo 3 ",143355,new,MCO71985
MCO538703041,"Radio Carro Pantalla Bluetooth Usb + Espejo (andro",174900,new,MCO409392
MCO539379042,"Rollo Plastico Papel Burbuja De 30cm X 50mts ",17575,new,MCO441185
MCO539935721,"Tablero Acrílico Borrable Cuadriculado 120x80cm+po",133900,new,MCO168370
MCO540317146,"Inflador De Globos Electrico 600w Doble Boquilla",54900,new,MCO432170
MCO540396700,"60 Metros Soga Cabuya Fique 6 Mm Rasca Gatos Envio",56050,new,MCO384755
MCO540485150,"5 Rollos Papel Burbuja De 30cm X 50mts Burbuja Est",79121,new,MCO441185
MCO540717329,"Caja Musical Queen Bohemian Rhapsody Madera Freddi",42593,new,MCO1228
MCO543493463,"Guacharaca Güiro Madera Corta 30 Cm",30900,new,MCO413431
MCO546084596,"40 Metros De Soga Cuerda Cabuya Fique 8 Mm Decorac",46550,new,MCO384755
MCO547297635,"Espejo Retrovisor Punto Ciego 360  Convexo - 2 Uni",12350,new,MCO174843
MCO548989931,"Espejo Retrovisor Punto Ciego 360 Grados  - 2 Unid",12408,new,MCO174843
MCO549732944,"Kit Tatuaje Tatuar Tattoo 2 Maquinas Profesionales",279900,new,MCO412100
MCO550160954,"Chocolate Corona Zebra",8450,new,MCO177942
MCO550378432,"Pulsera Personalizada Grabada En Láser Acero",35000,new,MCO1434
MCO550770859,"Radio Carro Pantalla 7' Tactil Mirrorlink Bluetoot",189900,new,MCO409392
MCO550837677,"Venda Elastica Autoadhesiva Kinesiologica",6926,new,MCO179916
MCO551046114,"Pijamas Termicas Para Bebes , Marca Bebitos",39900,new,MCO39957
MCO553557551,"Silla Mecedora Para Bebé De 0 A  5 Años Musical Vi",142000,new,MCO71985
MCO554457206,"Manilla De Seguridad-brazaletes Vip-papel Tyvek-pa",25000,new,MCO166867
MCO555828781,"Oso Panda De Peluche Gigante 1,40 Metros + Envío G",177900,new,MCO176652
MCO557274662,"Guantes Desechables Nitrilo Black Caja 100 Unidade",33470,new,MCO169105
MCO557742635,"Pijama Térmica Enteriza Para Bebe , Marca Bebitos",34900,new,MCO39957
MCO557871105,"Batería Pila Cr2032 Murata Sony Original Litio, 3v",12500,new,MCO7279
MCO558398339,"Colageno Hidrolizado Incluye Obsequio - L a $35000",35000,new,MCO8830
MCO558511242,"Camiseta Cuello Redondo T-shirt Color Manga Corta",18200,new,MCO157283
MCO558745647,"Coche Bebe Reversible+ Pañalera+cubrepie+ Toldillo",258000,new,MCO15047
MCO559508714,"Carpa Pijama Semi-impermeable Para Moto Con Argoll",30900,new,MCO90075
MCO560287837,"Pila Murata Cr2032 Voltaje 3v Pack X 5",11000,new,MCO7279
MCO561687940,"Pijamas Termicas Para Bebes , Marca Bebitos",35900,new,MCO39957
MCO561808484,"Pin Insignia Ellie Grape Soda. Película Up. X 2 Un",14900,new,MCO8591
MCO562282536,"Medias Y Manilla Set Estimulación Temprana Bebés",38000,new,MCO420453
MCO562286973,"Guitarra Acústica+forro +método+pick De Rasgueo+en",150000,new,MCO29465
MCO562433644,"Caja De Incienso X 200 Varitas - Aromaterapia",26800,new,MCO387586
MCO563153800,"Stencil Proton 1.5 Oz Tattoo & Tatuaje Plantilla T",17955,new,MCO412100
MCO563219161,"Cafe De La Sierra Nevada - Gourmet Premium 500gr. ",24900,new,MCO409413
MCO563233708,"Papel Fotográfico Brillante 180 Gr X 20 Hojas",8985,new,MCO416637
MCO563872000,"Pantalon En Dril Licrado Para Hombre ",58900,new,MCO157289
MCO564427813,"Mancuernas Pesas 40kg 80lb Antideslizante Termofor",184200,new,MCO167674
MCO564932759,"Pantalon Jeans Hombre Clasico Tonos",55000,new,MCO157289
MCO565689436,"Pijama Bebe Enteriza Beisbol",38900,new,MCO31419
MCO566245058,"Pijama Termica Bebe Vaquitas",38900,new,MCO31419
MCO566270839,"Pulsera Manilla Harry Potter Quidditch Snitch ",8990,new,MCO1434
MCO567105433,"Bicicleta Estatica  Spinning Gimnasio ",527900,new,MCO31049
MCO567122283,"Escalera Tubular De 2 Pasos Masescaleras ",110415,new,MCO172892
MCO567566294,"Combo Gamer Teclado Y Mouse Usb @gs",36616,new,MCO6263
MCO568029775,"Ducha Tipo Teléfono 2 1/2  Antisarro Cromada Yarde",48500,new,MCO412370
MCO569648831,"Guitarra Acústica Mate +forro+método +pick +envío ",150000,new,MCO29465
MCO569974566,"Ventilador Turbo Silence Compact2en1 Ng Samurai 14",209900,new,MCO115346
MCO570059471,"Soju Bebida Coreana Licor - L a $143",51500,new,MCO442299
MCO570072526,"Papel Fotografico 135 Gr, Premium, A4 X 100 Unidad",20930,new,MCO416637
MCO570147739,"Caja Musical Sailor Moon Rosada Canción Opening An",43000,new,MCO1228
MCO571464380,"Kit De Pesas Ejercicio Mancuernas Juego De Pesas T",109900,new,MCO167674
MCO571817761,"Silla Ejecutiva Ergonómica Reclinable Con Espaldar",174900,new,MCO113544
MCO573669634,"Anillos De Pareja Plata 925 Corona Caballero Regal",26000,new,MCO116329
MCO574335807,"Reloj Termohigrometro Digital Sonda Temperatura Hu",24250,new,MCO166629
MCO575196556,"Escalera Telescópica De 13 Pasos Más Escalera 3.8m",391920,new,MCO172892
MCO575340469,"Cinta Kinesiologicas Terapeutica",17100,new,MCO179916
MCO576114532,"2 Piezas De Piel Sintética Para Tatuar",16000,new,MCO412100
MCO576318703,"50 Hojas Papel Foto Adhesivo Brillante Tamaño A4 (",22830,new,MCO416637
MCO576536181,"Rollo Térmico 80x60 Caja X 60 Unidades Para Pos-fa",290366,new,MCO416637
MCO577072806,"Caja Musical Elvis Can't Help Falling In Love Rega",43000,new,MCO1228
MCO577238346,"Camara Robotica Inalambrica Wifi 3 Antenas 360º V.",71440,new,MCO5844
MCO582736751,"Café De La Sierra Nevada - Gourmet En Grano ",24900,new,MCO409413
MCO583258146,"Elefante Peluche Almohada Bebe 60cm Extra Suave",63609,new,MCO176652
MCO585359246,"3x Colageno Vainilla Vitaliah - Unidad a $34867",104600,new,MCO8830
MCO585507417,"Camara Ip De Seguridad Vigilancia Exterior 1080 Do",126340,new,MCO5844
MCO587283589,"Hoja Para Monedas Antiguas Colombianas",8800,new,MCO9355
MCO587996120,"Juego De Herramienta 85pz Copas Reparación Carro M",99900,new,MCO372032
MCO588668769,"Espejo Retrovisor Punto Ciego 360 Grados - 2 Unida",11900,new,MCO174843
MCO588863383,"Juego De Copas 39 Piezas Pretul Rache Mecánica Car",36900,new,MCO372032
MCO589238895,"Guitarra Clásica+forro Lona+método De Aprendizaje+",150000,new,MCO29465
MCO590213777,"Crema Tatuajes Old Tattoo 21gr Vitamina A Y D Repa",14749,new,MCO412113
MCO590214229,"Crema Tatuajes Old Tattoo 9gr Vitamina A Y D Repar",6990,new,MCO412113
MCO590688868,"Camisetas Cuello En V Color Algodón 180 Gramos",19713,new,MCO157283
MCO593312278,"Guitarras De Estudio Para Adultos, Forro En Lona,m",155000,new,MCO29465
MCO593478460,"Collares Magnéticos Parejas Novios Amor Imán Regal",17340,new,MCO116331
MCO593550634,"Piano Yamaha Psr E273 Estuche + Base + Dvd + Atril",918000,new,MCO2997
MCO593665357,"3kg  Resina Epóxica Transparente Para Maderas Y Ar",264000,new,MCO455716
MCO593681238,"1,5 Kg Resina Epóxica Transparente Para Maderas Y ",132000,new,MCO455716
MCO594547711,"Teclado Yamaha Psr-e373 Nuevo+ Adaptador+base+peda",1449000,new,MCO2997
MCO594548075,"Teclado Yamaha Psr-e373 Nuevo + Adaptador + Base D",1359000,new,MCO2997
MCO595202370,"Bicicleta Estatica Spinning Gimnasio Fitness Yb-ls",899250,new,MCO31049
MCO595415616,"Uniforme Pijama Medica Mujer Antifluido Scrub ",56905,new,MCO441893
MCO596411416,"Corrector De Postura Espalda Hombres Y Mujeres Uni",25900,new,MCO8837
MCO596797685,"Silla Mecedora Musical + Vibradora Plegable Posici",250000,new,MCO71985
MCO597595639,"Anillos Pareja Plata 925 Mujer Hombre Elegantes Co",26000,new,MCO116329
MCO598610692,"Jogger Dril Camuflado ",66700,new,MCO157289
MCO598611139,"Bascula Digital Deluxe Balanza Personal De Baño 18",27900,new,MCO169104
MCO599728938,"Coche Moisés Para Bebe Marca Snooze Baby ",625000,new,MCO15047
MCO600168277,"Aguardiente Mil Demonios - mL a $220",164990,new,MCO442299
MCO600656668,"Pesa Balanza Inteligente Bluetooth Grasa Peso Corp",34900,new,MCO169104
MCO601119171,"Forro Protector Mascotas Carro Alas Plus Ultra + C",160000,new,MCO407376
MCO602897535,"Manilla Seguridad Papel Tyvek Para Eventos ( 1.000",125000,new,MCO166867
MCO602899159,"Manillas Seguridad Papel Tyvek Para Eventos ( 100 ",30000,new,MCO166867
MCO602899347,"Manillas Seguridad Papel Tyvek Eventos ( 1.000 Imp",135000,new,MCO166867
MCO602899427,"Manillas Seguridad Papel Tyvek Eventos ( 500 Impre",75000,new,MCO166867
MCO603458010,"Guitarra Acústica En Cedro+ Forro+método+puá+envío",155000,new,MCO29465
MCO603569380,"Botellita Miniatura Licor Jagermeister - mL a $546",10910,new,MCO442299
MCO603688432,"Venda Elastica Autoadhesiva Kinesiologica",6942,new,MCO179916
MCO603931525,"Abanico De Techo De 56   Kdk Linea Económica",170000,new,MCO115346
MCO604339758,"Rollo Cabuya Mecate Cuerda Soga De Yute Fique Ecol",11900,new,MCO384755
MCO606052325,"Coche Paseador Para Bebé Liviano 3 Ruedas Multipos",204000,new,MCO15047
MCO606606187,"Radio Carro Pantalla Tactil 7  Bluetooth Camara ",187833,new,MCO409392
MCO606610741,"Cinta Kinesiologicas Terapeutica Kinesiotape",15944,new,MCO179916
MCO606824085,"Incienso Sahumerio Hem Caja 200 Baritas Diversas F",27000,new,MCO387586
MCO607288303,"Cinturón De Carga Y Seguridad Levantamiento De Pes",39900,new,MCO8837
MCO608087963,"Anillo Hombre Acero Inoxidable",14163,new,MCO116329
MCO608150859,"Caja Resma Papel Carta X 10 Unidades",181690,new,MCO416632
MCO608513023,"Pantalon Dril Licrado Para Hombre ",58900,new,MCO157289
MCO608530321,"Uniforme Antifluido Dama Unicolor + Gorro + 2 Tapa",48900,new,MCO441893
MCO608847788,"Vitamina A Y D Pote X150gr Tattoo Cuidado Piel Tat",24990,new,MCO412113
MCO610337481,"Tubitos Hama Beads Midi 5mm Bolsa X 300 Perlas Mag",4900,new,MCO1161
MCO610773769,"Cadena 55 Cm Titanio Plateada 5 Mm De Grosor Hombr",27900,new,MCO116331
MCO610951513,"Kit De Pesas Ejercicio Mancuernas Juego De Pesas T",116300,new,MCO167674
MCO611440270,"Minoxidil Forte 5% Colmed 100ml - mL a $551",55100,new,MCO1266
MCO611763583,"Salvia Blanca Californiana Rollo 10cm -cosecha Sos",13900,new,MCO387586
MCO613167945,"Camara Robotica Ip Wifi Full Hd 1080p Exterior Ptz",126340,new,MCO5844
MCO613476900,"Medias Pantalón Veladas Niña Bebé",8900,new,MCO420453
MCO613482428,"Habladores Exhibidores En Acrílico Original 2mm Me",18999,new,MCO441185
MCO613483986,"Habladores Exhibidores Acrílico Original 2mm Cuart",14500,new,MCO441185
MCO615620169,"Guacharaca Guiro Carrasca Fiesta Parranda Vallenat",23000,new,MCO413431
MCO615624841,"Guacharaca Guiro Carrasca Para Amenizar Tus Fiesta",22000,new,MCO413431
MCO615685495,"Uniforme Pijama Medica Hombre Antifluido Scrub ",60705,new,MCO441893
MCO615815945,"Mouse Inalámbrico Genius  Nx-7000 Calm Black",32660,new,MCO1714
MCO615965051,"Pulsera Manilla Yin Yang Parejas Amor Y Conexion T",18813,new,MCO1434
MCO616764173,"Citrato De Magnesio & Potasio - g a $95",47600,new,MCO8830
MCO618049088,"Audífonos Sony Tipo Banda Para La Cabeza - Mdr-zx1",59900,new,MCO3697
MCO618083050,"Forro Protector Para Sillas + Correa Cinturón De S",52155,new,MCO407376
MCO618536323,"Micrófono Fifine K669 Condensador Cardioide Negro",188300,new,MCO4633
MCO618545171,"Apple Earpods Con Conector De 3.5 Mm - Blanco",58000,new,MCO5072
MCO618862110,"Lentejas Diana 6 Bolsas Por 500 Gramos",29600,new,MCO389311
MCO618868960,"Catalogo Billetes Y Monedas Ultima Edicion Actuali",30510,new,MCO9356
MCO620546880,"Fifa 18  Legacy Edition Electronic Arts Ps3 Digita",4500,new,MCO163237
MCO621221288,"Arroz Diana Blanco Vitamor X 10 Libras",26000,new,MCO389311
MCO621222454,"Mario Kart 8 Deluxe  Mario Kart Deluxe Edition Nin",208080,new,MCO163237
